日付,コメント
2023.09.22,"8月の酷暑の中引越しをお願いしました。搬出作業はテキパキと進められましたが、搬入時は疲れていたのか乱雑になり、終盤は適当に入れられた感が強いです。荷物を入れたダンボールも乱雑に扱われたのか破れているものも散見されました。
何よりも下請けのエアコン移設業者が最悪でした。搬出時に部品を破損され、このままでは取付け出来ない、修理が必要で費用もかかる・・・壊したのはあんたの会社でしょ??
持ち帰り修理になり、また連絡すると言ったきり1週間以上経過して、アートへ問い合わせたところ、慌てて電話してきて、結局このエアコンが取付けられたのは2週間以上後でした。そのためこの暑い中その部屋の片付けは止まったまま。
また、作業に一人で来られていてリビング用の別のエアコンが大型のため一人では無理とか言いだし、翌日になるかもと言い出す始末。(こちらは応援が来られて、なんとか当日設置)
費用もなんだかんだと事細かに請求があり、1台数万円。。踏んだり蹴ったりです。
最終的に壊されたエアコンについては取り付け費用も含めて無料になりましたが(作業者には数万取られたので、後日アートへ再度クレーム)、もう二度とアートには頼まない。"
2023.03.03,"机を搬出する際、大きくて　そのままでは廊下を通らない為
解体し、引っ越し先で組み立てをお願いしたのですが
「この部品（電動昇降式のバッテリーの受け皿）いらないみたいです」
と言われ渡されたので「いや、この部品はここに取り付けるんですよ」
と言って、取り付けてもらいました。"
2023.07.19,椅子の足は折れ、テーブルは傷がつけられました。他はまあまあ良い単身者引越しで3年ほど前に利用しました。なぜ引越しセンターに連絡しなかったかというと、当時とても忙しくて、補償のことを調べる頃には3ヶ月以上が経過していたからです。
2023.01.25,引っ越し料金は複数社の見積もりの中で断トツ安く、スタッフの方々も気持ちよく作業していただきました。ただ、引っ越し先に到着し、家具を運び入れている最中に、重い家具やベッドの下のマット、クローゼットの消臭・防虫シート等の売り込みあり。金額を確認しなかった自分が一番悪いのですが、「マット引いておきましょうか？」「シート貼っておきましょうか？」と値段の説明もなく、ともするとサービスなのかな？と思わせる口調で言われるがままにお願いしたら、最後に引っ越し代金とほぼ同額の請求を受けました。事前に金額を確認しなかった自分が悪いので、お支払しましたが１０万単位の費用が発生するならあらかじめ金額を伝えるべきではないかと思いました。効果の程は分からず、重くない家具の下にもひかれてしまったマットは見栄えが悪いので取り外しました。みなさま、お気をつけください。。。。
2023.02.12,"一人暮らしの引越しで利用。
数社に見積もりを取って、最後に来ていただいた。
その時点で最安値だった業者さんと数万の開きがあったため、正直に伝えてお断りしようとしたところ、最安値の業者さんに合わせて値下げしてきたのでお願いすることに。
（30,000円以上下がりました。他社の見積もりのことを言わなかったらどうなったのだろうとは思います）
見積もりに来てくださった営業の方は非常に丁寧で、契約決めた途端に車からすぐに梱包材を持ち込んできました。かなり余裕のある量を頂けたので、梱包には全く困らず。
引越し当日は、いかにもリーダー的な方と、そこそこ慣れてそうな若い男性と若い女性（おそらくアルバイト？）。
女性の不慣れさが顕著で、見ているこちらがヒヤヒヤしました。ただし、不慣れそうなだけで一生懸命さはありました。
引越しは時間に余裕を持って完了し、後日の段ボール回収をお願いした際も電話対応や回収共にとても愛想良い対応でした。おそらく地域差もあると思うのですが、次回も頼みたいなと思えるくらいの対応でした。"
2023.05.16,"３回利用しています。
地方なので引っ越し業者の選択肢が少ないのですが、必ず複数業者に見積もりを依頼して、結果アートさんにお願いしています。
アートさんは他社の見積もりがあれば値引き交渉にも応じてくれますし、値引き幅が少ないときは段ボールなどの資材でサービスしてくれます。
依頼する際は必ず他社の見積書を用意することをお勧めします！
ただ、オプションの説明時間が長い・・・
打ち合わせのときと、引っ越し当日にオプションを勧められます。
無理に進めてくるわけではないですが、種類も多いので説明時間も長く、ひとつひとつのオプションにいるいらないの返事をするのが大変でした。
しかし、当日に引っ越し先で洗濯機ホースが合わないことが分かった際、その場でホースの手配とホースの設置を急遽してくださり（オプション料金はつきましたが）、とても助かりました！
急なお願いにも答えてくれるので、また利用したいと思っています。"
2022.10.10,"梱包からやってくださる安心パックで20万程でした。安かろう悪かろうとも言うし、安心をお金で買った気でした。
ところが当日の作業は雑だし、作業員は愛想のカケラもないしで、これだったら底辺の引っ越し業者と変わらなかったなと心底ガッカリしました。
冷蔵庫のコンセントを抜くのは当日で良いと言われたのに、いざ抜いてもらったら水が漏れてビショビショ。作業員の方は何もしてくれなかったので、自分が後始末をしました。また引っ越し先では、取り外したウォシュレットを入れた段ボールから水が大量に漏れていて、しかもそれが洋服ダンスの上に置かれていたので、洋服ダンスと床一体がびしょ濡れになりました。一体何の為に高額を出してお願いしたのか、無駄な仕事まで増やされました。そもそも洋服の上にウォシュレットを置くのってどうなの？と思ってしまいました。
運んでもらった物干し竿も壊され、挙げ句の果てには荷物運搬時に貼っていた養生をマンションの共用スペースに貼ったまま忘れて帰ったので、こちらから電話しました。
また作業員の方はこちらが何かをお願いしても返事をしてくれなかったり、室内ではちあわせた時もこれ見よがしに無言で立っていたり、無駄なものを買わされそうになって断るとあからさまに不機嫌になったりして、一体何なの？と思ってしまいました。
「お客様は神様」みたいなことは全く思っていませんが、人間として最低限の、他人に不快な思いをさせない行動をその短時間にすら出来ないのかと思ってしまいました。もう二度と利用したくないし、親戚はもちろん、それ以外の方にも契約しようとしている方は今一度考えてほしいって思います。"
2023.02.15,"単身ということもあり、電話のみの見積もりでした。
引っ越し前日に、荷物の内容変更をお問合せし、「後ほど営業所よりお電話します」と言われましたが、電話は来ませんでした。
当日来られた作業員の方はその変更を知らされておりませんでした。
さらに見積もりに記載のある荷物複数が、作業員に送付される作業指示書には記載されておらず、「指示書に書いてある荷物以外は運べない」と言われました。
手持ちの見積もりをお見せし、「見積もりにはしっかりと書かれているので運んでいただきたい」と伝えるも、「結構トラックいっぱいいっぱいなので載せられたら載せてみますが、全部はムリです」と言われました。
その後問合せ窓口に電話し、その旨伝えたところ、作業員に電話があったようで、「こちらの手違いだったようで、荷物を新居に置いたらまた戻って取ってきます」と言ってくださり、対応いただきました。
トラブル無く安心してお任せしたかったので、少し高くてもアート引越センターを選んだのですが、少し残念でした。
作業員の方は一生懸命やってくださいました。

しかし一番閉口してしまったのは、営業所の上司です。
支払い手続きでシステムエラーのようになった為、作業員の方が営業所の上司にお電話されていたのですが、電話の向こうから「だから○○が違うっつってんだろ！」「バカや野郎！」「確認しろっ！バーカ！」と言う怒鳴り声が聞こえて、労基に通報しようかと思うほど、作業員の方が本当にかわいそうでした…。
作業員の方は大きなミスをしたわけでもないですし、むしろしたとしても怒鳴るなんてことは社会人として常軌を逸してます。
アート引越センターは大手なので良いイメージがありましたが、「ブラック企業なんだな」「パワハラ上司なんだな」と知ってしまい、次回は別の業者さんにしようと思いました。"
2023.04.20,先日引越しました。間違って、引越し前のマンションの備品が、引越し先に運ばれていました。アートさんの過失だから、引き上げて、マンションに返却してくれるだろうと思ってましたが、最終確認で、その間違いに気づかずに、サインした私の100%過失だから、元に戻すのに、3万かかるといわれました。アートさんは、こちらの言い分ではなく、引越しした担当者からの言い分を聞き、取り合ってくれませんでした。最終確認で、自分の荷物が、忘れていない事を見てサインしたのですが、余分に運ばれてしまった事に気づかなかっただけで、3万。アートさんの対応に、正直、幻滅してます。会社を休み、レンタカーを借りて、備品を返しに行きます。1万くらいかかりますが、3万払うよりマシです。最終確認サインしたら、アートさんは、間違っていても、サインした方が悪いようなので、くれぐれも注意して下さい。こんなに不愉快な事は、無いです。
2023.06.11,"複数社で見積もりを取りました。他社より高かったが一人立ちしたばかりの営業マンが初々しく誠意を感じた為、契約しましたが、その後の対応が最悪でした。
引越し前日に、朝一の9時から契約したはずなのに、午後2時に向かいますとの連絡。契約が違う旨を伝えると2時になってるの一点張り。契約書の控えを提示したところ、新人の営業マンが上司の決裁を取りやすくするために2時に書き換えたことを認め上司が謝罪し、予定通り9時からになるもトラックが準備できないとのことで2台から1台に変更。
それ以前にも、ダンボールの配達を近くを通ったからと頼んでいない日時にいきなり持ってきたこともあった為、アートの信頼は失墜。
当日は、トラックを一台にした為、引越し時間は延長。
挙句の果てにロードバイクを積み忘れてきたと言い、自分で取りに行くハメに。ロードバイクを取りに戻った為、新居への待ち合わせに遅れて行くと、謝罪もなく、むしろ遅いですと言わんばかりの態度。そしてあり得ないことに養生もすることなくすでに新居の玄関前に家具や家電が並べてある状態。サービスの靴下履き替えをするわけでもなく、パンフレットとは全く違う引越しでした。その後も、引越し当日に洗濯機の取付業社が取付作業をしようとしたところ洗濯機のホースが割れてる事が判明。普段なら自分かもしれないと思い苦情を入れることはしないが、これまでのアートの行動から間違いなく壊したなと思い、電話したところ、すぐに認めるも、またも謝罪することなく、こちらで修理費を出しますとの当たり前のことのみ。引越し後にも以前住んでいたマンションのゴミ捨て場にアートが余ったダンボールを捨てて行ったとのことで回収に行くハメに。
これだけのことをし、時間も手間も使わせ、トラックも一台減り、朝一引越しとのことで通常より高め料金だったにも関わらず価格の見直しは一切なし。むしろ洗濯機のカサ上げ代はしっかり徴収されました。
無駄な時間を余計に取られこんなに疲れてイライラする引越しは初めてでした。今後、頼むことはないですし、周りの方にも絶対勧めない会社です。街中でトラックを見る度にイライラが蘇るほど腹が立っています。"
2023.04.08,"単身、長距離の引越しに利用させていただきました。
引っ越し業者によって地域毎に強い/弱いがあるそうで、他社に比べて非常に安い値段で対応していただきました。
また当日作業してくださった社員さんと思われる方々もとても爽やかで、テキパキと動いてくださり、とても満足しておりました。"
2022.06.05,"４時間ほどかかる、県を跨ぐ引っ越しの際に利用しました。いくつか見積もりをしてもらい、引越しの日程の融通をきかせてくれたのでアートに決めました。
段ボールはたくさんいただけて、ガムテープは、割れ物やすぐ使うものを色分け出来るよう3色無料で付けてくれました。
衣服はハンガーにかけたまま梱包してもらえて、割と満足していたのですが、テレビボードがしっかり固定されておらず金具がなくなってしまい、棚が付けられなくなりました。
引っ越し先の県のアートのスタッフさんが、予備の金具を用意してくれて何とかなりましたが少しがっかりでした。
それと、アルバイトらしきヒョロヒョロの男の子が搬入した際にアパートの壁に傷を付けられてしまいました。正直に言ってくれて、後日料金もいただいたので対応は悪くなかったのですが、、これが新築だったらブチギレてました。
数年後に家を建て、別の引っ越し業者に頼みましたが、そこと比べたらまだマシだったように思います。"
2023.09.28,"大手他社とアートと2社見積もりをしてもらったら、アートは他社と比べて半額近い値段。荷物も結構多かったのだがサービスしてくれるとのこと。正直値段はかなり良心的でありがたかった。
今回アートに頼むのは2回目で、1回目の引越しでは養生もしっかりしてくれ、荷物の扱いも丁寧だった。が、今回はかなり雑。家具を壊すこと1回（修復できた）、床に落とすこと2回。養生もしっかりしてなかったのでフローリングに傷がついてた。こちらが見てないと思ったのか知らんふりして、対応も最悪だなと思った。
他社の見積もり時に「アートさんは人によって荷物の扱いが違う」と言っていたのだがその通りだと思った。その会社は「ウチは社員が対応し、丁寧さはしっかり教育しています」と。
値段は安いが荷物の扱いはその時のガチャによるアートにするか、値段は高いが丁寧な仕事をする会社を選ぶか…"
2020.03.15,"市内の引っ越し、見積もりをたてましたが、見積もりの段階では男性の店長さん？がとてもしっかりしていて、信頼おけると思ったからです。
が、当日こられたのは、タバコの匂いプンプン、チャラっとしたギャルっぽい女性リーダーさんをはじめ、女の子が4人と男性一人。
ささっと、家具を覆って、運ぶ姿はカッコよかったです。
が、休憩の後にあったときはやはりタバコの匂いがすごくて、引っ越し作業でお客さんと接するサービス業だから、なるべく吸わない方がいいと思う。
お仕事終わって会社で吸うにはいいと思いますが…。
あと、今回引っ越し費用だけで10万しましたが、見積もりは他よりは安かったです。"
2022.12.20,"夢のマイホームを建て、元々住んでいた賃貸から新築への引っ越しをアートに依頼しました。
最初に、営業マンは、養生を完璧にし、家具も全て綺麗に拭いて、しっかりとした研修受けた者が作業すると言い、値段もそこまで高くなかった。
それを信頼してアートに決めました。
しかし蓋を開けてみると、元々住んでいた賃貸にガムテープのゴミは置いていく。捨てると言った粗大ゴミはマンションの廊下に置きっぱなし。バイトの1人は何もせずに立っているが、家具の掃除もしないで、6時間以上かかった。"
2023.06.30,今後、2度と利用しません。洗濯機の設置が別料金で6000円程度かかります。別業者に頼んでいてエアコン設置も兼任しています。私は洗濯機だけでしたが、洗濯機＋エアコン2台などになると時間が掛かりスケジュール管理がうまく設定できないとのことです。引っ越しが終わったら県をまたいで現地にいくという非効率なやり方していて、サカイの仕事も請け負っていると聞きました。私は引っ越しを数回しているので、冷蔵庫のコンセントは前日の夜に抜き、設置後は1時間くらいしてから入れるものと思っていましたが。運び入れた直後にコンセントを入れていました。冷蔵庫の中の棚板は斜めに傾き、レンジのアース線は繫がれることなくそのまま。洗濯機の排水ホースから水が漏れて防水パンの中に水たまりができていました。冷蔵庫の下に敷くマット3800円＆洗濯機の足＆段ボール回収3000円の営業3段階は不快でした。物件を決める際に不動産会社の窓口で見た広告には段ボールは無料回収と書かれていましたが、他の窓口から申し込んだ私は何も知らないと思ったようです。市のごみセンターに持ち込めば１キロ100円ですから相当なぼったくりです。室内を養生する＆靴下を履き替えるなどの配慮はありましたが、上辺の印象だけ良くしている感じですね。
2022.10.17,"大手さんなので丁寧な作業してくれると期待していたのにとても残念。
作業はテキパキこなしてくれたが、新築の家の玄関框に傷をつけられた。
私が指摘したら上の方に連絡していたが、明らかに気付くだろうという傷もあったのに確認もせずに帰ろうとしてた。
無料で修理してもらって目立たなくはなったが修理した跡は残っていて悲しい。
養生も雑。「ベリベリベリッ！」と勢いよく養生テープはがすので壁紙が剥がれるのではないかと心配になった。
新築だから本当に丁寧に作業してほしかったので、作業前に心付け多めに渡してるのに意味なかった。
それと、ダンボール無料引き渡しを予約した際は「作業が終わってからなので夕方以降になります」と伝えられてたのに、引き渡し当日朝8:30に電話がかかってきて「13:00-15:00の間に伺います」と言われた。家を傷つけられてからアートさんに対しての怒りが収まらないのに、より腹が立った。"
2023.05.04,"引越し屋さんは、嫁さんが独身時代からアートさんを信頼していて、我が家の過去3回の引越しは全てアートさんでした。
このタンスの損傷がわかったのは3回目の引越し時でしたが、タンスを出そうとした作業員さんが、「ここに損傷があるので、確認してください。」と言ってきました。写真は、私が木工ボンドを使って修復した後ですが、損傷が見つかった時は、養生テープでべったり貼り付けられた状態でした。
2回目の引越しの際に損傷し、それを壁面につけるように配置して誤魔化していたようです。見つけた作業員さんも、そういう推理をしたようですが、「前の引越しもアートさんですよ。」と言うと、無言になりました。
2回目の引越しの際、荷入れをする時に作業長がやたら愛想よく、家具の配置もアドバイスしてきたのは、こう言うことだったのかと理解しました。
まあ、その作業長が引越し先の不具合（建築会社の施行ミス）も見つけてアドバイスしてくれたこともあったので、まあチャラにしますが。"
2022.10.30,相見積もりにて非常にお安くしてくださったので安心してお願いしました。当日は男女一名ずつで来ましたが、女性がとても感じ悪い…。男性は物腰の柔らかい感じで良かったです。運ぶだけじゃないと謳って家具を拭いてくれるサービスがありますが、「お客様、雑巾借りても良いですか？」と聞かれた時はビックリしました。おいおい、そちらの提供しているサービスじゃないのかよ…。おまけに急に話しかけてくるなぁと思ったら、ベッドの脱臭シートの押し売り。そのくらいこちらで用意してますけど。全体的な作業もとても遅かった様に思います。噂通りの段ボール回収サービスも、お願いの電話を入れたのに回収に来ることはありませんでした。今まで色んな業者様にお願いしてきましたが、もうお願いしないと思いますがこれじゃサ◯イには負けますね。
2023.05.29,"数社見積もりを取った中で一番安く、しかも昔からある大手の会社さんなので信頼して頼みましが、残念ながらかなり厳しい評価をせざるを得ない結果でした。
まず、玄関、室内の壁、エレベーター等に養生をせず荷物を搬出し始めました。私がパンフレットの作業内容と違うことを指摘して、やっと養生を始めました。そして搬入の際も養生をせずに作業を始めようとしたと、引越先の管理人さんから聞きました。この時は管理人さんが注意してくださったようです。
作業内容は一言でいうと「雑」でした。本棚やテレビ台の棚ダボは、サイズの異なるものをひとまとめにされてしまった挙句、大量に紛失されてしまいました。加えて電気スタンド、室内物干し台など、複数の荷物が破損されてしまいました。
他方、営業の方や、物品の破損対応に当たられたスタッフの方は親切でしたが、やはり事故があってからでは遅いです。期待していた会社さんだけに、返す返す残念な思いです。"
2023.10.04,"以前同じ市内の引越し（車で25分くらいの距離・家族3人分）を頼みました。
社員2人・アルバイト2人の合計4人で来ました。午後1時から搬出でしたが、アルバイトの2人がほとんど動かずに「このタンス、めんどくさいよな・・・」「これ、重たくない？」など、こちらにも聞こえる声で話してました。4人でやれば普通は2時間もあれば搬出が終わるところ、3時間たっても半分くらいしか進んでいない状態で、社員の方が応援を呼びました。あとから別の社員が2人来て午後6時くらいにようやく搬出が終わりました。そこから引越し先へ行って全部搬入が終わったのが午後8時半くらいでした。動かないアルバイト2人のためにとても時間がかかった引越しでした。"
